{
    "$schema": "http://json-schema.org/draft-07/schema#",
    "title": "Outdoor Map Schema",
    "description": "Schema for D&D outdoor hex map data",
    "type": "object",
    "required": [
        "type",
        "gridSize",
        "terrain",
        "pois",
        "zoom",
        "panX",
        "panY"
    ],
    "properties": {
        "type": {
            "type": "string",
            "enum": [
                "outdoor"
            ],
            "description": "Map type identifier"
        },
        "gridSize": {
            "type": "integer",
            "minimum": 5,
            "maximum": 100,
            "description": "Hex grid dimension in pixels"
        },
        "terrain": {
            "type": "object",
            "description": "Mapping of hex coordinates to terrain types",
            "additionalProperties": {
                "type": "string",
                "enum": [
                    "plains",
                    "hills",
                    "forest",
                    "mountains",
                    "desert",
                    "swamp",
                    "tundra",
                    "water"
                ]
            },
            "propertyNames": {
                "pattern": "^[0-9]+,[0-9]+$"
            }
        },
        "pois": {
            "type": "array",
            "description": "Array of points of interest on the map",
            "items": {
                "type": "object",
                "required": [
                    "id",
                    "type",
                    "q",
                    "r",
                    "visible",
                    "label"
                ],
                "properties": {
                    "id": {
                        "type": "string",
                        "description": "Unique identifier for the point of interest"
                    },
                    "type": {
                        "type": "string",
                        "enum": [
                            "settlement",
                            "dungeon",
                            "camp",
                            "tower",
                            "loreSite",
                            "hazard",
                            "naturalWonder",
                            "landmark"
                        ],
                        "description": "Category of the point of interest"
                    },
                    "q": {
                        "type": "integer",
                        "description": "Hex axial column coordinate"
                    },
                    "r": {
                        "type": "integer",
                        "description": "Hex axial row coordinate"
                    },
                    "visible": {
                        "type": "boolean",
                        "description": "Whether the point of interest is visible on the map"
                    },
                    "label": {
                        "type": "string",
                        "description": "Display name for the point of interest"
                    }
                }
            }
        },
        "zoom": {
            "type": "number",
            "description": "Current zoom level of the map view"
        },
        "panX": {
            "type": "number",
            "description": "Horizontal pan offset of the map view"
        },
        "panY": {
            "type": "number",
            "description": "Vertical pan offset of the map view"
        }
    }
}
