{
  "type": "outdoor",
  "gridSize": 30,
  "terrain": {
    "0,0": "tundra",
    "1,0": "plains",
    "2,0": "plains",
    "3,0": "plains",
    "4,0": "plains",
    "5,0": "plains",
    "6,0": "plains",
    "7,0": "plains",
    "8,0": "plains",
    "9,0": "plains",
    "10,0": "plains",
    "11,0": "plains",
    "12,0": "plains",
    "13,0": "plains",
    "14,0": "hills",
    "15,0": "plains",
    "16,0": "water",
    "17,0": "water",
    "18,0": "water",
    "19,0": "plains",
    "20,0": "mountains",
    "21,0": "mountains",
    "22,0": "plains",
    "23,0": "hills",
    "24,0": "hills",
    "25,0": "swamp",
    "26,0": "forest",
    "27,0": "forest",
    "28,0": "forest",
    "29,0": "tundra",
    "0,1": "tundra",
    "1,1": "hills",
    "2,1": "hills",
    "3,1": "plains",
    "4,1": "desert",
    "5,1": "plains",
    "6,1": "plains",
    "7,1": "plains",
    "8,1": "hills",
    "9,1": "hills",
    "10,1": "hills",
    "11,1": "plains",
    "12,1": "plains",
    "13,1": "plains",
    "14,1": "hills",
    "15,1": "plains",
    "16,1": "water",
    "17,1": "water",
    "18,1": "plains",
    "19,1": "plains",
    "20,1": "plains",
    "21,1": "mountains",
    "22,1": "plains",
    "23,1": "hills",
    "24,1": "plains",
    "25,1": "swamp",
    "26,1": "forest",
    "27,1": "hills",
    "28,1": "forest",
    "29,1": "tundra",
    "0,2": "tundra",
    "1,2": "forest",
    "2,2": "hills",
    "3,2": "plains",
    "4,2": "water",
    "5,2": "plains",
    "6,2": "plains",
    "7,2": "plains",
    "8,2": "plains",
    "9,2": "hills",
    "10,2": "hills",
    "11,2": "hills",
    "12,2": "plains",
    "13,2": "hills",
    "14,2": "hills",
    "15,2": "hills",
    "16,2": "water",
    "17,2": "water",
    "18,2": "plains",
    "19,2": "plains",
    "20,2": "plains",
    "21,2": "mountains",
    "22,2": "plains",
    "23,2": "plains",
    "24,2": "water",
    "25,2": "water",
    "26,2": "plains",
    "27,2": "hills",
    "28,2": "forest",
    "29,2": "tundra",
    "0,3": "forest",
    "1,3": "forest",
    "2,3": "hills",
    "3,3": "water",
    "4,3": "water",
    "5,3": "water",
    "6,3": "water",
    "7,3": "water",
    "8,3": "water",
    "9,3": "plains",
    "10,3": "hills",
    "11,3": "hills",
    "12,3": "hills",
    "13,3": "hills",
    "14,3": "hills",
    "15,3": "hills",
    "16,3": "plains",
    "17,3": "plains",
    "18,3": "hills",
    "19,3": "plains",
    "20,3": "plains",
    "21,3": "plains",
    "22,3": "desert",
    "23,3": "plains",
    "24,3": "water",
    "25,3": "water",
    "26,3": "water",
    "27,3": "hills",
    "28,3": "forest",
    "29,3": "tundra",
    "0,4": "forest",
    "1,4": "hills",
    "2,4": "plains",
    "3,4": "water",
    "4,4": "water",
    "5,4": "water",
    "6,4": "water",
    "7,4": "water",
    "8,4": "water",
    "9,4": "water",
    "10,4": "plains",
    "11,4": "hills",
    "12,4": "hills",
    "13,4": "hills",
    "14,4": "hills",
    "15,4": "hills",
    "16,4": "hills",
    "17,4": "hills",
    "18,4": "hills",
    "19,4": "plains",
    "20,4": "plains",
    "21,4": "plains",
    "22,4": "desert",
    "23,4": "water",
    "24,4": "water",
    "25,4": "water",
    "26,4": "water",
    "27,4": "hills",
    "28,4": "forest",
    "29,4": "tundra",
    "0,5": "forest",
    "1,5": "hills",
    "2,5": "plains",
    "3,5": "water",
    "4,5": "water",
    "5,5": "water",
    "6,5": "water",
    "7,5": "water",
    "8,5": "swamp",
    "9,5": "water",
    "10,5": "plains",
    "11,5": "hills",
    "12,5": "hills",
    "13,5": "hills",
    "14,5": "hills",
    "15,5": "hills",
    "16,5": "hills",
    "17,5": "hills",
    "18,5": "hills",
    "19,5": "plains",
    "20,5": "plains",
    "21,5": "plains",
    "22,5": "desert",
    "23,5": "desert",
    "24,5": "water",
    "25,5": "water",
    "26,5": "plains",
    "27,5": "hills",
    "28,5": "forest",
    "29,5": "tundra",
    "0,6": "hills",
    "1,6": "hills",
    "2,6": "hills",
    "3,6": "hills",
    "4,6": "plains",
    "5,6": "plains",
    "6,6": "plains",
    "7,6": "hills",
    "8,6": "hills",
    "9,6": "hills",
    "10,6": "hills",
    "11,6": "hills",
    "12,6": "hills",
    "13,6": "hills",
    "14,6": "hills",
    "15,6": "hills",
    "16,6": "plains",
    "17,6": "plains",
    "18,6": "plains",
    "19,6": "plains",
    "20,6": "plains",
    "21,6": "plains",
    "22,6": "plains",
    "23,6": "plains",
    "24,6": "plains",
    "25,6": "plains",
    "26,6": "hills",
    "27,6": "hills",
    "28,6": "forest",
    "29,6": "forest",
    "0,7": "hills",
    "1,7": "hills",
    "2,7": "plains",
    "3,7": "plains",
    "4,7": "hills",
    "5,7": "hills",
    "6,7": "forest",
    "7,7": "forest",
    "8,7": "forest",
    "9,7": "forest",
    "10,7": "forest",
    "11,7": "hills",
    "12,7": "hills",
    "13,7": "hills",
    "14,7": "hills",
    "15,7": "hills",
    "16,7": "swamp",
    "17,7": "swamp",
    "18,7": "plains",
    "19,7": "plains",
    "20,7": "plains",
    "21,7": "desert",
    "22,7": "plains",
    "23,7": "hills",
    "24,7": "hills",
    "25,7": "hills",
    "26,7": "forest",
    "27,7": "forest",
    "28,7": "forest",
    "29,7": "forest",
    "0,8": "plains",
    "1,8": "plains",
    "2,8": "plains",
    "3,8": "hills",
    "4,8": "plains",
    "5,8": "plains",
    "6,8": "tundra",
    "7,8": "tundra",
    "8,8": "tundra",
    "9,8": "tundra",
    "10,8": "tundra",
    "11,8": "plains",
    "12,8": "plains",
    "13,8": "hills",
    "14,8": "hills",
    "15,8": "plains",
    "16,8": "swamp",
    "17,8": "water",
    "18,8": "water",
    "19,8": "plains",
    "20,8": "plains",
    "21,8": "plains",
    "22,8": "plains",
    "23,8": "hills",
    "24,8": "plains",
    "25,8": "tundra",
    "26,8": "tundra",
    "27,8": "forest",
    "28,8": "forest",
    "29,8": "swamp",
    "0,9": "desert",
    "1,9": "plains",
    "2,9": "plains",
    "3,9": "hills",
    "4,9": "plains",
    "5,9": "plains",
    "6,9": "tundra",
    "7,9": "tundra",
    "8,9": "tundra",
    "9,9": "tundra",
    "10,9": "tundra",
    "11,9": "forest",
    "12,9": "hills",
    "13,9": "hills",
    "14,9": "hills",
    "15,9": "plains",
    "16,9": "water",
    "17,9": "water",
    "18,9": "swamp",
    "19,9": "plains",
    "20,9": "hills",
    "21,9": "plains",
    "22,9": "hills",
    "23,9": "hills",
    "24,9": "tundra",
    "25,9": "tundra",
    "26,9": "forest",
    "27,9": "forest",
    "28,9": "forest",
    "29,9": "swamp",
    "0,10": "desert",
    "1,10": "plains",
    "2,10": "plains",
    "3,10": "hills",
    "4,10": "plains",
    "5,10": "tundra",
    "6,10": "tundra",
    "7,10": "tundra",
    "8,10": "tundra",
    "9,10": "forest",
    "10,10": "forest",
    "11,10": "forest",
    "12,10": "plains",
    "13,10": "hills",
    "14,10": "plains",
    "15,10": "swamp",
    "16,10": "water",
    "17,10": "water",
    "18,10": "swamp",
    "19,10": "plains",
    "20,10": "hills",
    "21,10": "hills",
    "22,10": "hills",
    "23,10": "forest",
    "24,10": "forest",
    "25,10": "forest",
    "26,10": "hills",
    "27,10": "hills",
    "28,10": "hills",
    "29,10": "swamp",
    "0,11": "water",
    "1,11": "plains",
    "2,11": "hills",
    "3,11": "forest",
    "4,11": "forest",
    "5,11": "forest",
    "6,11": "forest",
    "7,11": "forest",
    "8,11": "forest",
    "9,11": "forest",
    "10,11": "hills",
    "11,11": "hills",
    "12,11": "plains",
    "13,11": "water",
    "14,11": "water",
    "15,11": "water",
    "16,11": "water",
    "17,11": "water",
    "18,11": "water",
    "19,11": "swamp",
    "20,11": "forest",
    "21,11": "forest",
    "22,11": "forest",
    "23,11": "forest",
    "24,11": "forest",
    "25,11": "forest",
    "26,11": "forest",
    "27,11": "hills",
    "28,11": "hills",
    "29,11": "hills",
    "0,12": "water",
    "1,12": "plains",
    "2,12": "hills",
    "3,12": "hills",
    "4,12": "forest",
    "5,12": "forest",
    "6,12": "forest",
    "7,12": "forest",
    "8,12": "forest",
    "9,12": "forest",
    "10,12": "hills",
    "11,12": "plains",
    "12,12": "water",
    "13,12": "water",
    "14,12": "water",
    "15,12": "water",
    "16,12": "water",
    "17,12": "water",
    "18,12": "water",
    "19,12": "swamp",
    "20,12": "forest",
    "21,12": "forest",
    "22,12": "forest",
    "23,12": "swamp",
    "24,12": "swamp",
    "25,12": "swamp",
    "26,12": "swamp",
    "27,12": "plains",
    "28,12": "plains",
    "29,12": "hills",
    "0,13": "water",
    "1,13": "plains",
    "2,13": "hills",
    "3,13": "hills",
    "4,13": "forest",
    "5,13": "forest",
    "6,13": "forest",
    "7,13": "forest",
    "8,13": "forest",
    "9,13": "forest",
    "10,13": "plains",
    "11,13": "plains",
    "12,13": "water",
    "13,13": "water",
    "14,13": "water",
    "15,13": "water",
    "16,13": "water",
    "17,13": "water",
    "18,13": "swamp",
    "19,13": "swamp",
    "20,13": "forest",
    "21,13": "forest",
    "22,13": "forest",
    "23,13": "swamp",
    "24,13": "swamp",
    "25,13": "swamp",
    "26,13": "swamp",
    "27,13": "plains",
    "28,13": "hills",
    "29,13": "hills",
    "0,14": "desert",
    "1,14": "plains",
    "2,14": "hills",
    "3,14": "hills",
    "4,14": "forest",
    "5,14": "forest",
    "6,14": "forest",
    "7,14": "forest",
    "8,14": "hills",
    "9,14": "hills",
    "10,14": "hills",
    "11,14": "hills",
    "12,14": "plains",
    "13,14": "plains",
    "14,14": "plains",
    "15,14": "plains",
    "16,14": "swamp",
    "17,14": "swamp",
    "18,14": "swamp",
    "19,14": "forest",
    "20,14": "forest",
    "21,14": "forest",
    "22,14": "hills",
    "23,14": "hills",
    "24,14": "plains",
    "25,14": "swamp",
    "26,14": "plains",
    "27,14": "hills",
    "28,14": "hills",
    "29,14": "forest",
    "0,15": "plains",
    "1,15": "plains",
    "2,15": "hills",
    "3,15": "hills",
    "4,15": "forest",
    "5,15": "forest",
    "6,15": "plains",
    "7,15": "plains",
    "8,15": "plains",
    "9,15": "plains",
    "10,15": "hills",